{
  "id": "1MAvdleMIVLJm0qlhBet-WvjDFlrMU1uERgLnoOhHYMQ",
  "slug": "grandpa-catfishs-peach-cobbler",
  "title": "Grandpa Catfish's Peach Cobbler",
  "ingredients": [
    {
      "name": "butter melted",
      "quantity": "1/3",
      "unit": "cups"
    },
    {
      "name": "sugar",
      "quantity": "1",
      "unit": "cup"
    },
    {
      "name": "flour",
      "quantity": "1",
      "unit": "cup"
    },
    {
      "name": "baking powder",
      "quantity": "1",
      "unit": "teaspoon"
    },
    {
      "name": "milk",
      "quantity": "¾",
      "unit": "cups"
    },
    {
      "name": "salt",
      "quantity": "¼",
      "unit": "teaspoon"
    },
    {
      "name": "ground cinnamon",
      "quantity": "1",
      "unit": "teaspoon"
    },
    {
      "name": "peaches",
      "quantity": "1",
      "unit": "can"
    }
  ],
  "markdown": "Nathan,\n\nThis one comes from Grandpa Catfish as well and please trust that it is so amazing and everything you could ever want a peach to be. I love you dearly.\n\nMom\n\n* 1/3 cups butter melted\n* 1 cup sugar\n* 1 cup flour\n* 1 teaspoon baking powder\n* ¾ cups milk\n* ¼ teaspoon salt\n* 1 teaspoon ground cinnamon\n* 1 can of peaches (see **for directions if you want to do the peaches from fresh or frozen)\n* Preheat oven to 350 degrees\n* In a baking dish pour in the can of peaches\n* ** if you are making the peaches from frozen or fresh\n* Put 2 cups of sliced frozen or fresh peaches into a pot and place on a medium to low setting\n* Mix in 1 cup of sugar and 3 tablespoons lime juice\n* Allow the peaches to cook down in the simple syrup for approximately 5 min\n* In a bowl mix all the other ingredients other than the melted butter to make a batter\n* Pour batter mixture over the peaches in the baking dish spreading out evenly\n* Take melted butter and spread over all the contents in the baking dish\n* Bake for 1 hour or until batter is cooked through and golden brown\n",
  "summary": "Nathan,\n\nThis one comes from Grandpa Catfish as well and please trust that it is so amazing and everything you could ever want a peach to be. I love you dearly.\n\nMom\n\n",
  "preparation": "* Preheat oven to 350 degrees\n* In a baking dish pour in the can of peaches\n* ** if you are making the peaches from frozen or fresh\n* Put 2 cups of sliced frozen or fresh peaches into a pot and place on a medium to low setting\n* Mix in 1 cup of sugar and 3 tablespoons lime juice\n* Allow the peaches to cook down in the simple syrup for approximately 5 min\n* In a bowl mix all the other ingredients other than the melted butter to make a batter\n* Pour batter mixture over the peaches in the baking dish spreading out evenly\n* Take melted butter and spread over all the contents in the baking dish\n* Bake for 1 hour or until batter is cooked through and golden brown\n",
  "metadata": {
    "date": "2022-08-16T00:00:00.000Z",
    "tags": [
      "cobbler",
      "peach",
      "sweet"
    ],
    "prep": "5m",
    "cook": "1h",
    "servings": "12s",
    "level": "easy"
  },
  "heroImage": "generated-hero.png"
}