{
  "id": "1J1kez7l-eOhjyZBwXlC7vRv_uhSzwaygCr8blQURCkM",
  "slug": "coffee-cake-muffins",
  "title": "Coffee Cake Muffins",
  "ingredients": [
    {
      "name": "flour",
      "quantity": "3",
      "unit": "tablespoons"
    },
    {
      "name": "brown sugar",
      "quantity": "3",
      "unit": "tablespoons"
    },
    {
      "name": "cinnamon",
      "quantity": "¼",
      "unit": "teaspoon"
    },
    {
      "name": "butter (softened)",
      "quantity": "2",
      "unit": "tablespoons"
    },
    {
      "name": "chopped walnuts or pecans",
      "quantity": "3",
      "unit": "tablespoons"
    },
    {
      "name": "flour",
      "quantity": "1 ½",
      "unit": "cups"
    },
    {
      "name": "sugar",
      "quantity": "½",
      "unit": "cup"
    },
    {
      "name": "baking powder",
      "quantity": "1 ¼",
      "unit": "teaspoon"
    },
    {
      "name": "cinnamon",
      "quantity": "½",
      "unit": "teaspoon"
    },
    {
      "name": "ground ginger",
      "quantity": "¼",
      "unit": "teaspoon"
    },
    {
      "name": "baking soda",
      "quantity": "¼",
      "unit": "teaspoon"
    },
    {
      "name": "salt",
      "quantity": "¼",
      "unit": "teaspoon"
    },
    {
      "name": "softened butter",
      "quantity": "¼",
      "unit": "cup"
    },
    {
      "name": "egg",
      "quantity": "1",
      "unit": null
    },
    {
      "name": "buttermilk or sour milk",
      "quantity": "½",
      "unit": "cup"
    }
  ],
  "markdown": "Nathan,\n\nThese muffins aren’t the most fun to make but they really make a splash at any breakfast or tea party. I love you dearly.\n\nMom\n\n* 3 tablespoons flour\n* 3 tablespoons brown sugar\n* ¼ teaspoon cinnamon\n* 2 tablespoons butter (softened)\n* 3 tablespoons chopped walnuts or pecans\n* * 1 ½ cups flour\n* * ½ cup sugar\n* * 1 ¼ teaspoon baking powder\n* * ½ teaspoon cinnamon\n* * ¼ teaspoon ground ginger\n* * ¼ teaspoon baking soda\n* * ¼ teaspoon salt\n* * ¼ cup softened butter\n* ** 1 egg\n* ** ½ cup buttermilk or sour milk\n* Preheat oven to 400 degrees and put 12 muffin cups into muffin tins\n* Mix all topping ingredients in a small bowl and set aside\n* Mix dry ingredients in medium bowl cut in the butter until mixture resembles coarse crumbs\n* Mix egg and buttermilk and add all at once to the dry mixture. \n* Stir until moistened (should be lumpy)\n* Spoon ½ of the batter into the muffin cups filling each one ⅓ full\n* Put ½ of the topping mixture in the muffin cups on the 1st half of the batter\n* Spoon the remaining batter into the muffin cups \n* Finish with the last of the topping mixture making a layered muffin\n* Bake at 400 degrees for 15 to 18 min\n",
  "summary": "Nathan,\n\nThese muffins aren’t the most fun to make but they really make a splash at any breakfast or tea party. I love you dearly.\n\nMom\n\n",
  "preparation": "* Preheat oven to 400 degrees and put 12 muffin cups into muffin tins\n* Mix all topping ingredients in a small bowl and set aside\n* Mix dry ingredients in medium bowl cut in the butter until mixture resembles coarse crumbs\n* Mix egg and buttermilk and add all at once to the dry mixture. \n* Stir until moistened (should be lumpy)\n* Spoon ½ of the batter into the muffin cups filling each one ⅓ full\n* Put ½ of the topping mixture in the muffin cups on the 1st half of the batter\n* Spoon the remaining batter into the muffin cups \n* Finish with the last of the topping mixture making a layered muffin\n* Bake at 400 degrees for 15 to 18 min\n",
  "metadata": {
    "date": "2022-08-16T00:00:00.000Z",
    "tags": [
      "muffin",
      "coffee cake",
      "sweet",
      "breakfast"
    ],
    "prep": "5m",
    "cook": "18m",
    "servings": "24s",
    "level": "easy"
  }
}